{
  "timeline_id": "palace_1930_canonical_v0_6",
  "universe_id": "palace_1930",
  "version": "0.6.0",
  "status": "specified",
  "timezone": "Europe/Paris",
  "calendar": {
    "gala_date": "1934-02-17",
    "discovery_date": "1934-02-18"
  },
  "invariance_contract": {
    "crime_facts_identical_across_variants": true,
    "culprit_method_motive_and_core_times_locked": true,
    "social_overlays_may_change_by_variant": true,
    "rule": "Le crime, les déplacements des quatre rôles centraux, les horaires verrouillés et la vérité historique sont identiques. Les rôles supplémentaires ne font que porter ou dramatiser des informations déjà canoniques."
  },
  "locked_windows": {
    "medical_bag_first_unattended": {"start": "15:41", "end": "15:45"},
    "preparation_removed": {"start": "15:42", "end": "15:44"},
    "service_key_held_by_culprit": {"start": "15:50", "end": "16:04"},
    "bottle_substitution": {"start": "15:57", "end": "16:02"},
    "medical_bag_second_unattended": {"start": "18:06", "end": "18:10"},
    "toxic_ingestion": {"start": "22:21", "end": "22:22"},
    "victim_enters_locked_office": "22:45",
    "estimated_death": "23:08",
    "body_discovered": "07:55"
  },
  "events": [
    {
      "id": "evt_001",
      "date": "1934-02-17",
      "time": "14:12",
      "phase": "historical_truth_arrives",
      "location": "reception",
      "classification": "core_fact_variable_carrier",
      "actors": [],
      "fact": "Le pli de Genève contenant l'acte de 1919, l'annexe de copropriété Mercier-Valleroy et le registre notarial atteint le palace.",
      "proof_function": "Introduire la preuve authentique du mensonge fondateur.",
      "variants": "Le porteur est défini dans la table de diffusion de variante."
    },
    {
      "id": "evt_002",
      "date": "1934-02-17",
      "time": "14:30",
      "phase": "financial_pressure",
      "location": "petit_salon",
      "classification": "core_fact_variable_carrier",
      "actors": ["npc_victim"],
      "fact": "Auguste reçoit les conditions finales de vente ; une revendication Mercier rendrait l'opération impossible.",
      "proof_function": "Donner à Armand et Jeanne des intérêts opposés mais puissants."
    },
    {
      "id": "evt_003",
      "date": "1934-02-17",
      "time": "14:47",
      "phase": "fraud_discovery",
      "location": "bureau_prive",
      "classification": "core",
      "actors": ["npc_victim", "role_04"],
      "fact": "Lucien remet le dossier de succession contenant le codicille non authentifié transmis à Camille.",
      "proof_function": "Fixer la chaîne de possession du document contemporain."
    },
    {
      "id": "evt_004",
      "date": "1934-02-17",
      "time": "14:55",
      "phase": "fraud_discovery",
      "location": "bureau_prive",
      "classification": "core",
      "actors": ["npc_victim", "role_04"],
      "fact": "Auguste et Lucien constatent une formulation inhabituelle et un sceau incompatible avec le registre.",
      "proof_function": "Établir la fausseté probable sans attribuer encore sa fabrication."
    },
    {
      "id": "evt_005",
      "date": "1934-02-17",
      "time": "15:03",
      "phase": "fraud_discovery",
      "location": "bureau_prive",
      "classification": "core",
      "actors": ["npc_victim", "role_04"],
      "fact": "Auguste dicte une note : il remettra le codicille à la police, suspendra la vente et fera expertiser les droits Mercier au petit déjeuner.",
      "proof_function": "Créer une menace différente pour presque tous les suspects."
    },
    {
      "id": "evt_006",
      "date": "1934-02-17",
      "time": "15:18",
      "phase": "culprit_trigger",
      "location": "salon_familial",
      "classification": "core_secret",
      "actors": ["npc_victim", "role_01"],
      "fact": "Auguste annonce à Camille que le codicille est faux, que la succession est gelée et que le palace pourrait devoir reconnaître les droits Mercier.",
      "proof_function": "Établir le mobile complet, révélé aux joueurs seulement à l'acte III."
    },
    {
      "id": "evt_007",
      "date": "1934-02-17",
      "time": "15:26",
      "phase": "culprit_trigger",
      "location": "hall_prive",
      "classification": "core_fact_variable_carrier",
      "actors": ["role_01"],
      "fact": "Une dernière mise en demeure confirme que Camille ne peut survivre financièrement sans héritage rapide.",
      "proof_function": "Compléter le mobile financier sans prouver le meurtre."
    },
    {
      "id": "evt_008",
      "date": "1934-02-17",
      "time": "15:34",
      "phase": "crime_preparation",
      "location": "petit_salon",
      "classification": "core",
      "actors": ["role_01", "role_03"],
      "fact": "Camille simule un malaise et obtient l'examen de Gabriel.",
      "proof_function": "Créer une proximité avec la trousse, encore explicable comme un véritable examen."
    },
    {
      "id": "evt_009",
      "date": "1934-02-17",
      "time": "15:41",
      "phase": "crime_preparation",
      "location": "petit_salon",
      "classification": "core",
      "actors": ["role_03"],
      "fact": "Gabriel est appelé en cuisine et laisse sa trousse fermée dans le petit salon.",
      "proof_function": "Ouvrir la première fenêtre d'accès."
    },
    {
      "id": "evt_010",
      "date": "1934-02-17",
      "time": "15:43",
      "phase": "crime_preparation",
      "location": "petit_salon",
      "classification": "core_secret",
      "actors": ["role_01"],
      "fact": "Camille prélève une préparation toxique entièrement fictive.",
      "proof_function": "Établir l'origine réelle du moyen sans information chimique exploitable."
    },
    {
      "id": "evt_011",
      "date": "1934-02-17",
      "time": "15:45",
      "phase": "crime_preparation",
      "location": "petit_salon",
      "classification": "core",
      "actors": ["role_01", "role_03"],
      "fact": "Gabriel revient ; la trousse paraît intacte et Camille affirme aller mieux.",
      "proof_function": "Fermer la première fenêtre."
    },
    {
      "id": "evt_012",
      "date": "1934-02-17",
      "time": "15:50",
      "phase": "crime_preparation",
      "location": "reception_service",
      "classification": "core",
      "actors": ["role_01", "role_02"],
      "fact": "Camille emprunte une clé pour reprendre une miniature de sa mère conservée dans les appartements d'Auguste.",
      "proof_function": "Donner un accès réel mais aussi une justification vérifiable."
    },
    {
      "id": "evt_013",
      "date": "1934-02-17",
      "time": "15:56",
      "phase": "crime_preparation",
      "location": "couloir_prive",
      "classification": "core_fact_variable_witness",
      "actors": ["role_01"],
      "fact": "Une silhouette portant un signe familial des de Valleroy est aperçue dans le couloir privé ; le visage n'est pas identifié.",
      "proof_function": "Fragiliser l'alibi sans livrer directement le coupable."
    },
    {
      "id": "evt_014",
      "date": "1934-02-17",
      "time": "15:57",
      "end_time": "16:02",
      "phase": "crime_preparation",
      "location": "appartements_auguste",
      "classification": "core_secret",
      "actors": ["role_01"],
      "fact": "Camille récupère réellement la miniature puis substitue le contenu des gouttes digestives d'Auguste.",
      "proof_function": "Combiner une action innocente vérifiable avec l'action meurtrière cachée."
    },
    {
      "id": "evt_015",
      "date": "1934-02-17",
      "time": "16:04",
      "phase": "crime_preparation",
      "location": "reception_service",
      "classification": "core",
      "actors": ["role_01", "role_02"],
      "fact": "Camille rend la clé et conserve la miniature ; l'emprunt reste inscrit.",
      "proof_function": "Clore la fenêtre tout en empêchant que la clé soit une preuve suffisante."
    },
    {
      "id": "evt_016",
      "date": "1934-02-17",
      "time": "16:20",
      "phase": "historical_truth",
      "location": "chambre_invite",
      "classification": "core_fact_variable_carrier",
      "actors": [],
      "fact": "Le pli de Genève est ouvert : l'acte et l'annexe confirment le partenariat Mercier-Valleroy et les droits effacés après 1920.",
      "proof_function": "Prouver le mensonge fondateur sans désigner le meurtrier actuel."
    },
    {
      "id": "evt_017",
      "date": "1934-02-17",
      "time": "16:32",
      "phase": "historical_truth",
      "location": "vestiaire_des_dossiers",
      "classification": "core_fact_variable_carrier",
      "actors": [],
      "fact": "Le nom d'Émile Mercier, l'ancienne plaque et le sceau authentique sont documentés indépendamment.",
      "proof_function": "Éviter que la vérité historique repose sur un seul document."
    },
    {
      "id": "evt_018",
      "date": "1934-02-17",
      "time": "17:03",
      "end_time": "17:20",
      "phase": "false_leads",
      "location": "ancien_pavillon_thermal",
      "classification": "core",
      "actors": ["role_02"],
      "fact": "Jeanne cache le grand livre où figurent ses écritures falsifiées et les anciens versements d'Émile Mercier.",
      "proof_function": "Donner à Jeanne une absence, un secret financier et un mobile historique."
    },
    {
      "id": "evt_019",
      "date": "1934-02-17",
      "time": "17:07",
      "phase": "false_leads",
      "location": "bibliotheque",
      "classification": "core",
      "actors": ["role_04"],
      "fact": "Lucien cache ses faux reçus et plusieurs copies de lettres sur le partenariat Mercier.",
      "proof_function": "Donner à Lucien un pouvoir documentaire et une raison de mentir."
    },
    {
      "id": "evt_020",
      "date": "1934-02-17",
      "time": "18:06",
      "end_time": "18:10",
      "phase": "false_leads",
      "location": "poste_de_service",
      "classification": "core",
      "actors": ["role_03"],